{"understanding":"你发来的这句话在传输中出现编码损坏（乱码），我读不出具体内容——只能看出大概是一段中文，但主题、涉及的人或机构、你想办成什么都没法确认。这不是你在描述一个模糊目标，而是文字本身丢了信息，所以我不能假装读懂。","needs_clarification":true,"questions":[{"ask":"请用一句完整的话重说一次：你想让【谁】在【什么时间之前】办成【什么】？（不用写手机号、住址、身份证号）","why":"原话是乱码，我连这件事属于办事、投诉、购物还是找人帮忙都判断不了。凭猜给路径，很可能把你今天的时间花在完全不相干的方向上。"}],"safe_next_action":"把这件事用一句话写下来：我想让【谁】在【什么时候之前】办成【什么】，然后原样发给我。","next_action":{"text":"把这件事用一句话写下来：我想让【谁】在【什么时候之前】办成【什么】，然后原样发给我。","done_when":"","mode":"","handoff_task":"","handoff_target":""},"recommended_path":null,"resources":[],"uncertainties":["输入文本存在编码损坏，原始意图不可恢复；在重述之前，任何机构、政策、流程层面的判断都无从谈起。","我无法判断这件事是否涉及法律、医疗、政策、资格或价格等高风险判断，因此不做任何结论。"],"reality_feedback_prompt":"把这句话用正常汉字重发一次（谁、在哪、想办成什么）。收到后我立刻给你今天能做的第一步，不再追问第二遍。","fallback_if_refused":"如果懒得整句重打，只发一个关键词也行：这件事和谁有关（物业／社区／单位／医院／学校／某个平台／某个店／家人），我按关键词给下一步。","meta":{"guard_actions":[],"dropped_claims":[],"search_query_used":"","search_skipped_reason":"not_needed","searched":false,"evidence_available":0,"llm_calls":2,"search_calls":0,"llm_retry_count":1,"request_cost_rmb":0.084732,"month_cost_rmb":0.623952,"budget_mode":"file","model":"deepseek-flash","receipt_ingested":false,"receipt_status":""}}